,Unnamed: 0,name,latitude,longitude,rating,user_rating_count,reviews,photo_count,area,facilities,Town,description
60,60,Fanling Recreation Ground 11-a-side Natural Turf Soccer Pitch and Jogging Track,22.4941384,114.1373286,4.8,9,"Many football fields in Hong Kong can be used for different purposes, and this one is no exception. The facilities on the field are well maintained, and it is a great choice for morning exercise and jogging!; A very good natural grass football and jogging track, which can meet the needs of large-scale sports and music performances in the northern area.; It is part of the multi-purpose venue of Fanling Recreation Ground. In addition to playing football, it can also hold different forms of activities. It would be better if there is a track.",3,Not available via Google Places API,No facility details,Fanling,"Fanling Recreation Ground’s 11-a-side Soccer Pitch and Jogging Track is a well-maintained, multi-purpose venue for football, jogging, and events. Praised for its natural grass and suitability for morning exercise, it’s a great choice despite occasional closures for flower vendors."
61,61,Fanling Recreation Ground,22.4940173,114.1375364,3.8,659,"The place is nice but unfortunately it is closed down often during the nice weather winter months when people actually have free time to use it. It is commandeered throughout the Christmas holidays by the flower vendors who take a few days to set up, a week to sell their goods, and then usually take four or five days to take down their stalls - all so people who wouldn't normally set foot in the sports ground can come and buy flowers they could easily buy elsewhere.; Pleasant, clean and well situated close to Fanling MTR.; A good place to take a break. Just seat and relax.",3,Not available via Google Places API,No facility details,Fanling,"Fanling Recreation Ground in Fanling is a pleasant, clean venue near Fanling MTR, ideal for relaxation and sports. While well-situated, it’s often closed during winter for flower vendor events, limiting access for regular users."
62,62,"Fitness Room, Wo Hing Sports Centre",22.484754,114.143138,3.8,4,; ; ,0,Not available via Google Places API,No facility details,Fanling,"The Fitness Room at Wo Hing Sports Centre in Fanling provides basic fitness facilities within a spacious, clean environment. With limited feedback, it’s part of a larger sports centre, offering a convenient workout space for locals."
63,63,Fanling Public Library,22.5001429,114.144386,4.1,176,"This is easily one of the best public libraries i been
Very spacious, almost too big and not enough books
Very cold bring top
Huge study rooms
Enormous kids room
Dozens of computersto use
Hundreds of seats
Hard working security checking u every 5 minutes
Toilet on same floor
Outside main bus stop; Library is quite nice and staff great. The lifts are the dumbest I've seen anywhere and it's a nightmare trying to actually leave the library, unless you want to take the stairs that smells of urine.; The best reading library, where you can find a lot of reference materials and use the computer facilities to study and have a good time.",3,Not available via Google Places API,No facility details,Fanling,"Fanling Public Library is a spacious, modern facility with large study rooms, a kids’ room, and numerous computers. While praised for its size and resources, some note overly vigilant security and a urine-smelling staircase as drawbacks."
64,64,Fanling South Public Library,22.4870852,114.1433285,3.9,45,"The area is quite small. The staff were super nice there even the security was very eager to help me print out my stuff. It was a wonderful experience even though I was there for only 20 minutes!; many new books , quite small; Too small, too less books...",3,Not available via Google Places API,No facility details,Fanling,"Fanling South Public Library is a small but welcoming facility with helpful staff and new books. While appreciated for printing services and friendly service, its limited size and book collection are noted as constraints."
65,65,Fanling Swimming Pool,22.4951138,114.1360832,3.9,476,"Easily accessible by MTR.
Standard 50m outdoor pool. Spacious changing area. Facilities are well-maintained. 👍🏼
Lots of kids taking swim classes.; 17$ for normal entry. Has the usual hairdryer, showers & lockers.; Excellent place for learninnu to swim as it offers grab and go balloting for some classes and if lucky can get a place after 1 or 2 classes begun.",3,Not available via Google Places API,No facility details,Fanling,"Fanling Swimming Pool, accessible by MTR, features a well-maintained 50m outdoor pool and spacious changing areas. Affordable at 17 HKD, it’s popular for swim classes, with grab-and-go balloting for lessons, making it a great learning spot."
