,Unnamed: 0,name,latitude,longitude,rating,user_rating_count,reviews,photo_count,area,facilities,Town,description
26,26,Global Social Services Intercultural Community Library,22.4469786,114.003459,4.0,1,,1,Not available via Google Places API,No facility details,Tin Shui Wai,"Global Social Services Intercultural Community Library in Tin Shui Wai is a small, community-focused library with limited feedback. It provides basic library services, contributing to the area’s cultural offerings, and is appreciated for its role in fostering community engagement."
27,27,The Commercial Press (Tin Shui Wai),22.4623178,113.9996463,3.8,334,"On Sunday, June 30, 2024, Zia, Brian, Kuya Yan Yan, Ate Kat and Tita Maricris will go to the The Commercial Press (Tin Shui Wai), This is our 1st time, To buy something.; Medium size bookshop inside a shopping mall. There is hardly any bookshop in Tin Shui Wai, this maybe the one and only. Large collection of travel books and children learning books (mainly in Chinese). For all other categories, collection is to its minimum. Only one small shelf containing English books/novels. Furthermore, within this shelf, one third are self-help books. Not very inspiring. I would suggest to go outside New Territories if possible. This bookshop is lacking variety and choices.; Good environment, quiet and cozy, good coffee",3,Not available via Google Places API,No facility details,Tin Shui Wai,"The Commercial Press in Tin Shui Wai, located in a shopping mall, is a medium-sized bookshop with a focus on travel and children’s learning books, primarily in Chinese. While cozy and quiet, it’s criticized for its limited variety, especially in English books, but serves as a rare local bookshop."
28,28,"Mobile Library 3, Kingswood Country Club",22.459166,114.00608,5.0,1,,0,Not available via Google Places API,No facility details,Tin Shui Wai,"Mobile Library 3 at Kingswood Country Club in Tin Shui Wai offers mobile library services to residents, earning high praise for its convenience. With minimal feedback, it’s valued for bringing books directly to the community, enhancing access to reading materials."
29,29,Hong Kong YWCA Tin Shui Wai Integrated Social Service Centre (Youth-First),22.4549167,113.9993691,5.0,10,"Happy happy happy; A relaxing place where you can play switch, board games, and script killing; Fun! !
The only good place in Tin Shui Wai",3,Not available via Google Places API,No facility details,Tin Shui Wai,"Hong Kong YWCA Tin Shui Wai Integrated Social Service Centre (Youth-First) is a relaxing youth hub offering activities like Nintendo Switch, board games, and script killing. Highly rated as a fun, engaging space, it’s considered a standout community spot in Tin Shui Wai."
30,30,Tin Shui Community Centre,22.455146000000003,113.999307,3.8,80,"Ok; Very Good; There is a large auditorium in the basement, where free singing and dancing performances are regularly provided for the elderly.",3,Not available via Google Places API,No facility details,Tin Shui Wai,"Tin Shui Community Centre in Tin Shui Wai features a large basement auditorium hosting free singing and dancing performances for the elderly. Described as very good by locals, it serves as a vital community hub for cultural and social activities."
31,31,Tin Chak Shopping Centre,22.4683451,113.9986694,3.5,1611,"On Sunday, June 30, 2024, Zia, Brian, Kuya Yan Yan, Ate Kat and Tita Maricris will go to the Tin Chak Shopping Centre, This is our 1st time, To go shopping and eat in the restaurants.; Nice tidy very simple variety of shops, goods, food basic to personalized ... Tin Chak has enough diversity to be a mall; Friendly locals. Sorta got lost and had to ask a umm curvy local girl for help, which made me sorta nervous.  Uhhh, found the 🔑 key copying shop in the market. Got a copy of my key for $7 hkd. Can't really beat that price.",3,Not available via Google Places API,"Local shopping mall featuring stores for clothing, housewares & groceries, plus casual restaurants.",Tin Shui Wai,"Tin Chak Shopping Centre in Tin Shui Wai is a tidy mall with a variety of shops for clothing, housewares, and groceries, plus casual restaurants. Locals appreciate its diversity, friendly atmosphere, and affordable services like key copying, making it a convenient community hub."
32,32,"Mobile Library 10, Tin Shui Estate",22.4551994,113.9989998,,0,,2,Not available via Google Places API,No facility details,Tin Shui Wai,"Mobile Library 10 at Tin Shui Estate in Tin Shui Wai provides essential book-lending services to residents. With limited feedback, it’s valued for its accessibility, bringing library resources directly to the estate for community convenience."
33,33,Maywood Court Swimming Pool,22.4612721,114.0054382,3.7,3,"Very clean the water and reasonable rate
good facilities; ; ",3,Not available via Google Places API,No facility details,Tin Shui Wai,"Maywood Court Swimming Pool in Tin Shui Wai is a clean, affordable facility with reasonable rates and good amenities. Highly rated for its well-maintained water and facilities, it’s a popular choice for local swimmers seeking a reliable pool."
34,34,Yuen Long Sports Centre,22.4411233,114.0238488,4.2,375,"Vaccination staff was friendly and just need 30 minutes ( including rest time 15 minutes ) ❤️❤️❤️❤️
Stay safe everyone; This place is our upgrading test in Shek kip mei;)Probably all friends of UNITED taekwondo academy were here every Sunday to perform training poomsae!We do exercise coz we know health is wealth...I love UTA TEAM HONGKONG !; Many kids play here and its bcz near the library so some kids go in library too",3,Not available via Google Places API,No facility details,Yuen Long,"Yuen Long Sports Centre is a community hub offering various sports facilities and classes, including taekwondo. Popular with kids and families due to its proximity to a library, it’s praised for friendly staff and quick vaccination services, making it a health-focused destination."
35,35,Long Ping Sports Centre,22.4502277,114.0234298,3.6,302,"Very small and hard to find.The entrance of the sports centre is quite hidden,which is located next to cafe de coral.The changing room is even more hidden--down an inconspicuous flight of stairs,into a hidden area.The main arena is not large.; We had our swabtest done in this place and the results is favorable thank God.; community based, good facilities...need booking in advance...",3,Not available via Google Places API,No facility details,Yuen Long,"Long Ping Sports Centre in Yuen Long is a small, community-based facility with a hidden entrance near Cafe de Coral. Offering good facilities for sports like badminton, it’s valued for its role in community health, including swab testing, though its size and visibility are limitations."
36,36,Yuen Long District Sports Association Jockey Club Complex,22.442135,114.021992,4.1,179,"The equipment of the gym on the top floor is dated n taped with scotch tape. Otherwise, it has everything n the staff are very nice and helpful. I also attend the yoga classes. Clean facilities and well maintained. Spacious. Reasonable price. Yoga instructor Maria Chan is very nice and dedicated.; There is a fitness gym here at 6th floor and also near the yuen long stadium. And yuen long public swimming pool There are a lot of facilities to use here they have classes for taekwondo and a lot of sports classes to offer; Amazing food at the cafe on the ground floor, cheap and yummy!",3,Not available via Google Places API,No facility details,Yuen Long,"Yuen Long District Sports Association Jockey Club Complex is a spacious, well-maintained facility with a gym, yoga classes, and taekwondo programs. Located near Yuen Long Stadium and a public swimming pool, it’s praised for its clean facilities and affordable, tasty cafe food, despite some dated gym equipment."
37,37,Yuen Long Public Library,22.4414481,114.0239537,4.2,322,"One of Hong Kong’s newer public libraries this one in Yuen Long is deceptively large (it shares the building with a sports centre). Quite spacious reading areas but collection is of average size.; The venue itself is nice and cool. The time that I visit wasn't that much people coz it's quite late. The 2 stars are for the building itself ONLY. Since the staffs there weren't helpful at all. It made me with an unpleasant visit. At the entrance, staff there with the tone of voice made me feel offensive. The information / help desk on the ground floor, I was looking for a book and would like to ask the staff for help. She just asked me to search online, on the public library website. -_-"" Frankly, there wasn't any queue and she's not within something else, she just sat there doing nothing. If she's busy with something else and my question was too naive that it's not worth answering. Ok, that's fine, I will sort it out myself. All I can say is....  maybe she would like to enjoy her own time rather than helping a citizen's enquiry.; Lovely building with smart outlooking. But  not closed to the tram station... Acceptable walking distance. With good facilities for children aged.",3,Not available via Google Places API,No facility details,Yuen Long,"Yuen Long Public Library, sharing a building with a sports centre, offers spacious reading areas and a decent book collection. While the modern, cool environment is appreciated, some visitors find the staff unhelpful and the location a bit far from the tram station."
38,38,Yuen Long Swimming Pool,22.44167,114.0213437,3.8,481,"In general a good and clean facility but at the moment only one 50m pool is open. The other pools are under maintenance. So it is a little too crowded and people have to share the lanes.

EDIT:
I found another 25m pool on the opposite side of the facility. It is not so deep, but less crowded.

Main pool is under maintenance till early June.

EDIT:
Main Pool is open again. :) Less crowded now.; nearby Yuen Long Park
facilities are well maintained e.g. changing and shower
locker size is big enough
standard 50m and a training pool; Quite some distance from nearest railway station. The changing room is clean and large, but pool staff seems quite bureaucratic.",3,Not available via Google Places API,No facility details,Yuen Long,"Yuen Long Swimming Pool features a 50m main pool and a training pool, with well-maintained changing rooms and lockers. While generally clean, it can be crowded, with ongoing maintenance occasionally limiting access. Its distance from the railway station is a minor inconvenience."
39,39,Po Wing Road Sports Centre,22.4971579,114.1284529,4.2,782,Good selection of sports facilities available for hire. All are available for hire at regular or discount rates by HK citizens. One standout aspect is their provision of American pool tables which are a rarity among Hong Kong. Definitely recommend for people in the area to visit and join in on the physical activities; good place for resting n playing for children....make them exploring mindl n train their skill.....just for play n climb or maybe rolling; Well maintained and clean sport centre. I played table tennis over there and the courts are pretty good. Each court is on its own area separated by tall nets!,3,Not available via Google Places API,No facility details,Sheung Shui,"Po Wing Road Sports Centre in Sheung Shui offers a variety of sports facilities, including rare American pool tables, ideal for community activities. Well-maintained and clean, it’s popular for table tennis and children’s play, encouraging exploration and skill development."
40,40,Lung Sum Avenue Sports Centre,22.5050106,114.1306305,3.9,499,Great place to play basketball there; Great for indoor activities like badminton basketball  volleyball  and table-tennis 🏓; Totally 3 treadmills......2 are out of order.....,3,Not available via Google Places API,No facility details,Sheung Shui,"Lung Sum Avenue Sports Centre in Sheung Shui is a great venue for indoor sports like basketball, badminton, volleyball, and table tennis. While clean and spacious, some equipment, like treadmills, may be out of order, slightly impacting the experience."
41,41,North District Sports Ground,22.506311900000004,114.1305155,4.1,866,"Standard LCSD pitch. The home ground of North District Football club, a club competing in the Hong Kong Premier League, the top flight of association football in Hong Kong. Does not allow drums or other noise-making instruments, leading to a very poor atmosphere during HKPL matches. Pitch is not very well maintained, and it seems to be brown and patchy.; No proper seats, decent stand that is close to the pitch.; Beautiful Zoy Coysia natural grass pitch, it is undoubtedly one of the finest grass pitch in HK. However, it’s a pity that the Stadium is lacking a snack canteen or kiosk like other stadiums. Hope they could add one in the future, it is really inconvenient to be without a food counter.",3,Not available via Google Places API,No facility details,Sheung Shui,"North District Sports Ground in Sheung Shui, home to North District Football Club, features a high-quality Zoy Coysia grass pitch for football and other events. While the pitch is well-regarded, the lack of a snack kiosk and proper seating affects the atmosphere during matches."
42,42,Tin Ping Sports Centre,22.503462,114.133505,3.3,151,Old but very clean place. The lcsd service is the best I've ever been to in 6 years in HK.; not bad; old,3,Not available via Google Places API,No facility details,Sheung Shui,"Tin Ping Sports Centre in Sheung Shui is an older but clean facility managed by LCSD, offering various sports options. While praised for its cleanliness and service, its age is noted by some, making it a reliable but less modern community sports hub."
43,43,"North District Park (Basketball, Soccer-cum-Handball Court)",22.5004978,114.1330982,4.1,86,"Just found out that there are two trees(outside the basket ball court)which would change their colors in winter. What a nice surprise☺️; Enjoy play valleyball there; A good place for sports, good equipment, basketball, football, badminton, etc., and toilet",3,Not available via Google Places API,No facility details,Sheung Shui,"North District Park in Sheung Shui offers well-equipped basketball, football, and volleyball courts, with additional amenities like toilets. Locals enjoy its sports facilities and the seasonal beauty of nearby trees, making it a pleasant spot for community activities."
44,44,North District Sports Ground Tennis Courts,22.506594000000003,114.1292109,3.8,21,"A 10-minute walk from Sheung Shui Train Station, next to the sports stadium. Some tennis courts face east and west, so you have to wear sunglasses when playing. Other than that, there is no problem with Da Ao.; There are many parking spaces in the parking lot and parking is very convenient; The equipment is good and the staff is friendly.",3,Not available via Google Places API,No facility details,Sheung Shui,"North District Sports Ground Tennis Courts in Sheung Shui, a 10-minute walk from the train station, provide good equipment and friendly staff. While some courts face sun glare, the convenient parking and quality facilities make it a solid choice for tennis players."
45,45,Fitness Sport Centre,22.504934,114.126757,4.3,4,"Small-ish shop mainly for infirmity support. I would call it a Re-Ha shop. They have the doughnut shaped cushion to sit on, the Zimmer frame, the glucose meter, walking sticks and such. Dumb bells as well. I found what I needed after giving up on the Re-Ha shops in the hospitals.; good 👍; You can buy a lot of medical auxiliary equipment at the Parker Health Equipment Store. The female clerk is very polite and gives detailed introductions. She is a very nice person.",3,Not available via Google Places API,No facility details,Sheung Shui,"Fitness Sport Centre in Sheung Shui is a small shop specializing in infirmity support equipment like Zimmer frames and glucose meters. Described as a rehabilitation-focused store, it’s appreciated for its helpful staff and niche offerings for mobility needs."
46,46,Pak Wo Road Playground (7-a-side Soccer Pitches),22.4963556,114.1296066,4.6,19,"Those who love football will definitely like it!; Convenient parking, but unfortunately no shower; The place is big and suitable for playing football",3,Not available via Google Places API,No facility details,Sheung Shui,"Pak Wo Road Playground in Sheung Shui features spacious 7-a-side soccer pitches, ideal for football enthusiasts. While lacking showers, it offers convenient parking and is praised for its size and suitability for community sports."
47,47,24/7 Fitness Sheung Shui,22.5033607,114.1336576,4.6,74,"Friendly and super convenience. Spotlessly clean and all the equipment machines, free and railed weights you could hope for.
Love it; Nice, clean and spacious gym room. Most importantly, it's hygienic, not crowded and no hard sell. Convenient to go to anytime as well!; good",3,Not available via Google Places API,No facility details,Sheung Shui,"24/7 Fitness Sheung Shui is a clean, spacious gym with a variety of equipment, including free weights and machines. Highly rated for its hygiene, lack of crowds, and no-pressure environment, it’s a convenient, top-choice gym for locals."
48,48,Sheung Shui Swimming Pool,22.5058297,114.131692,3.8,87,"A big swimming pool,often crowded, so far its clean, employees service are okay, near sports center, price is fair; pool. is. so. small. water. slide. is. so. short.; A landmark for mountain bikers wishing to go to Tin Ping Shan.",3,Not available via Google Places API,No facility details,Sheung Shui,"Sheung Shui Swimming Pool is a large, clean outdoor facility with a 50m pool, often crowded with kids’ swim classes. While fairly priced and well-maintained, its small size and short water slide are noted drawbacks, but it’s a landmark for local mountain bikers."
49,49,Marathon Sports (Sheung Shui Centre),22.501197,114.12908,,0,,2,Not available via Google Places API,No facility details,Sheung Shui,"Marathon Sports in Sheung Shui Centre offers sports equipment in a retail setting. With limited feedback, it’s a convenient option for locals seeking sports gear, located within a shopping centre for easy access."
50,50,Po Wing Road Sports Centre Car Park,22.4973349,114.1287999,4.7,6,"Excellent indoor jogging track; Outdoor parking lot, multiple spaces, spacious, with three charging spaces; Reasonable price👍🏻",3,Not available via Google Places API,No facility details,Sheung Shui,"Po Wing Road Sports Centre Car Park in Sheung Shui provides spacious outdoor parking with charging spaces and an indoor jogging track. Reasonably priced and convenient, it’s a practical choice for visitors to the sports centre."
51,51,LEISURE and Cultural Services Department fitness room_sheung shui,22.4970022,114.1283651,2.6,5,"Broken TVs and several pieces of fitness equipment have not been repaired for a long time; The place is large, new and clean, with good ventilation; Don't want to go again",1,Not available via Google Places API,No facility details,Sheung Shui,"The LCSD Fitness Room in Sheung Shui is a large, clean, and well-ventilated space, though some equipment, like TVs, may be broken. Mixed reviews highlight its spaciousness but also dissatisfaction with maintenance, impacting the overall experience."
52,52,Volleyball Court,22.4998026,114.1325066,5.0,2,"A good place for sports, good equipment, basketball, football, badminton, etc., and toilet; Very popular with schools and groups.",3,Not available via Google Places API,No facility details,Sheung Shui,"The Volleyball Court in Sheung Shui is a popular, well-equipped venue for sports like volleyball, basketball, and football, with toilets available. Frequently used by schools and groups, it’s a reliable community hub for active recreation."
53,53,Stone Fitness Studio_上水泰拳瑜伽,22.5033054,114.1286087,4.7,11,"Nice cozy gym/ boxing studio with a small cafe, providing healthy and delicious light meals, coffee and cakes; Nice Place🙃; Good",3,Not available via Google Places API,No facility details,Sheung Shui,"Stone Fitness Studio in Sheung Shui is a cozy gym and boxing studio with a small cafe offering healthy meals. Praised for its friendly atmosphere and delicious light meals, it’s a welcoming spot for fitness and relaxation."
54,54,North District Sports Ground Car Park,22.50722,114.13017,4.5,10,"The place is spacious and has electricity; Nothing special, I don’t drive myself, it’s right next to the sports ground, close to Fengxi Nursing and Attention Home, and very close to Cuili Garden on the other side!; I am not a driver, but I heard that a large truck was on fire, so I took a look out of curiosity!",3,Not available via Google Places API,No facility details,Sheung Shui,"North District Sports Ground Car Park in Sheung Shui is spacious with electric charging options, conveniently located near the sports ground and local estates. While unremarkable, it serves as a practical parking solution for sports visitors."
55,55,Weedper Fitness Club 上水粉嶺泰拳瑜珈健身中心,22.5037051,114.1268903,4.9,13,"Location wise is convenient as it is situated right in front of Mannings. Fit and amiable coaches. 101% for their patience; testimonial from me, person who has terrible coordination. If I have to list out top one treassure I have discovered in Sheung Shui, no doubt it has to be them :); best coach and nice place; Nice coach",3,Not available via Google Places API,No facility details,Sheung Shui,"Weedper Fitness Club in Sheung Shui is a highly rated gym with friendly, patient coaches specializing in Thai boxing and yoga. Located near Mannings, it’s considered a top fitness treasure in the area for its supportive environment."
56,56,LEISURE and Cultural Services Department fitness room - Sheung shui,22.504981,114.130449,3.9,7,"It is a sports venue equipped with various sports facilities. It is a pity that many of them need to be suspended due to the epidemic. Everyone is quarantined, and the whole place needs to be quarantined? ? We hope that normal life and activities can resume everywhere in the world as soon as possible!; Hello from the disciples of Koppanapee.
Hemnithi sees Hong Kong, your city.
I like it.; ",0,Not available via Google Places API,No facility details,Sheung Shui,"The LCSD Fitness Room in Sheung Shui offers various sports facilities, though some were suspended during the epidemic. While appreciated for its potential, the quarantine-related closures have limited its use, with hopes for resumed activities."
57,57,Sheung Shui Public Library,22.5019475,114.1310677,3.8,129,"It's located on the 3rd floor of the government complex (G-1/F wet market, 2nd floor food court). Consider it has only one floor, the size is ok as it also has students self study centre.
The staff I saw was efficient in terms of stopping people from talking on the phone in the library. So overall the place was quiet.; Very nice library on 3rd floor. Quiet, clean, and large English reading section; The worst library I have ever been to! Old equipment, old facilities, stupid policy!",3,Not available via Google Places API,No facility details,Sheung Shui,"Sheung Shui Public Library, located on the 3rd floor of a government complex, is quiet and clean with a large English reading section and study centre. While spacious, some criticize its old equipment and strict policies, making it a mixed experience."
58,58,Wo Hing Sports Centre,22.4846267,114.1432188,3.9,248,"Good selection of sports facilities available for hire at regular and discounted rated. Sports centre common area is generally spacious and staff are helpful and friendly.

American pool table (one only) requires maintenance as soon as possible - cushions are unresponsive and felt plays very slow (i.e. Balls do not roll smoothly on the felt).; Forgotten to took entrance photo, one can walk across the village foot bridge bus stop instead of going to Wah Ming Terminus for same distamce but different atmosphere.; very good",3,Not available via Google Places API,No facility details,Fanling,"Wo Hing Sports Centre in Fanling offers a variety of sports facilities, including a slow-playing American pool table needing maintenance. Spacious and clean with helpful staff, it’s accessible via a village footbridge, making it a community favorite."
59,59,Luen Wo Hui Sports Centre,22.5000821,114.1445879,3.9,270,"When the computer system is down, the staff doesn't know what to do. It is like someone has never been worked there before. I thought the requirement working there, handing in chinese and English at least. The staff was helping me using their phone to find the Chinese words to copy. Since the system is down, they wouldn't find my profile on their system, and asked me to create my profile on the app after 4:30pm today. It just pissed me off.; A rather average sports hub in the Northern District; happiest moment sparing competition",3,Not available via Google Places API,No facility details,Fanling,"Luen Wo Hui Sports Centre in Fanling is an average sports hub with facilities for various activities. While staff efficiency varies, particularly during system issues, it remains a functional community space for sports and events."
